LastName,Email,Unique_Chewy_Id__c,Company
Donovan,closetohomevet@icloud.com,80171966,Close to Home Veterinary Services
Sisum,wnaturenut46@gmail.com,111395,Cape Cod Cat Hospital
Gould,applecountrystaff@gmail.com,26625,Apple Country Animal Hospital
PM,ontracvet@gmail.com,68918817,"On Trac Veterinary Care, Llc"
Smith,holly.smith@petcrossing.com,52808,Pet Crossing Animal Hospital
Test1,test1@email.com,1111,Test Company 1
Test2,test2@email.com,1112,Test Company 2
Test3,test3@email.com,1113,Test Company 3